<?xml version="1.0" encoding="UTF-8"?>
<dataroot xmlns:od="urn:schemas-microsoft-com:officedata" xmlns:xsi="http://www.w3.org/2001/XMLSchema-instance"  xsi:noNamespaceSchemaLocation="EXP.xsd" generated="2014-11-30T16:42:37">
<EXP>
<ID>LV01</ID>
<Level>1</Level>
<Next_x0020_EXP>100</Next_x0020_EXP>
</EXP>
<EXP>
<ID>LV02</ID>
<Level>2</Level>
<Next_x0020_EXP>150</Next_x0020_EXP>
</EXP>
<EXP>
<ID>LV03</ID>
<Level>3</Level>
<Next_x0020_EXP>225</Next_x0020_EXP>
</EXP>
<EXP>
<ID>LV04</ID>
<Level>4</Level>
<Next_x0020_EXP>360</Next_x0020_EXP>
</EXP>
<EXP>
<ID>LV05</ID>
<Level>5</Level>
<Next_x0020_EXP>576</Next_x0020_EXP>
</EXP>
<EXP>
<ID>LV06</ID>
<Level>6</Level>
<Next_x0020_EXP>921</Next_x0020_EXP>
</EXP>
<EXP>
<ID>LV07</ID>
<Level>7</Level>
<Next_x0020_EXP>1565</Next_x0020_EXP>
</EXP>
<EXP>
<ID>LV08</ID>
<Level>8</Level>
<Next_x0020_EXP>2661</Next_x0020_EXP>
</EXP>
<EXP>
<ID>LV09</ID>
<Level>9</Level>
<Next_x0020_EXP>4523</Next_x0020_EXP>
</EXP>
<EXP>
<ID>LV10</ID>
<Level>10</Level>
<Next_x0020_EXP>0</Next_x0020_EXP>
</EXP>
</dataroot>
